[
  {
    "id": "SQUARE-01",
    "trigger": { "type": "location_enter", "target": "TOWN_SQUARE", "once": true },
    "text": [
      "> You arrive at the square at 0347 hours. The streetlights flicker.",
      "> Your target CHEN WEI-LIN was last seen here 12 hours ago.",
      "> A wallet lies in the gutter near the statue.",
      "> [🪪] AGENCY BADGE + [🔫] W-90 at waist. Codec on channel 141.3.",
      "> You bend to examine the wallet.",
      "> [📄] INSIDE: American dollars, Chinese Yuan, a photo of a panda.",
      "> The photo is dated 1987. On the back: 'For Wei-Lin. Remember home.'",
      "> A woman watches from the tavern door. She vanishes when you look.",
      "> Your codec crackles. Handler: 'Status, Agent? Chen's gone dark.'"
    ],
    "choices": [
      { "id": "A", "prompt": "[🔍] INVESTIGATE the statue", "requirements": null, "outcomes": ["SQUARE-STATUE"] },
      { "id": "B", "prompt": "[🍻] ENTER the tavern", "requirements": null, "outcomes": ["TAVERN-01"] },
      { "id": "C", "prompt": "[🏃] PURSUE the woman", "requirements": null, "outcomes": ["CHURCH-01"] },
      { "id": "D", "prompt": "[📻] CALL Handler", "requirements": null, "outcomes": ["CODEC_HANDLER_INTRO"] }
    ],
    "effects": null
  },

  {
    "id": "SQUARE-02-ANALYSIS",
    "trigger": { "type": "synergy_complete", "target": "SYN-N02", "once": true },
    "text": [
      "> You spread the wallet's contents under the streetlamp and bring the glass close.",
      "> Receipts stop looking like trash. Ink patterns start looking like routing.",
      "> Chen was paid by multiple sources. Pinkertons AND Chinese.",
      "> The traces go back decades. This isn't a defection.",
      "> Your codec clicks — not static. A handshake tone. Logging.",
      "> Handler (141.3): 'Agent? What are you doing? That frequency—'",
      "> The line goes dead.",
      "> A second later: 'Return to base, Agent. That's an order.'",
      "> You feel the net tighten."
    ],
    "choices": null,
    "effects": {
      "delta": { "pinkerton_awareness": 15 },
      "set": {},
      "unlock_beats": ["SQUARE-03-ESCAPE_SEQUENCE"],
      "grant_items": [],
      "teleport": null
    }
  },

  {
    "id": "SQUARE-03-ESCAPE_SEQUENCE",
    "trigger": {
      "type": "state_threshold",
      "target": "agency_trust",
      "state_min": {},
      "state_max": { "agency_trust": 0 },
      "once": true
    },
    "text": [
      "> 'AGENT? This is DIRECTOR MORROW. RETURN TO BASE IMMEDIATELY.'",
      "> The codec blares. Two black SUVs pull into the square.",
      "> You recognize the suits. Internal Affairs. Threat Assessment.",
      "> 'You have questions about the asset. That's our job.'",
      "> Agent Miller steps out, hands raised. 'Come quietly. For your own good.'",
      "> Behind Miller, you see it—a shimmer. Someone in the church tower.",
      "> [🎯] DECISION: Surrender or Escape"
    ],
    "choices": [
      { "id": "SURRENDER", "prompt": "[🙋] SURRENDER to Internal Affairs", "requirements": null, "outcomes": ["CELL-01"] },
      { "id": "ESCAPE", "prompt": "[🏃] ESCAPE into the subway", "requirements": null, "outcomes": ["SUBWAY-01", "CELL-02"] }
    ],
    "effects": null
  },

  {
    "id": "CELL-01",
    "trigger": { "type": "manual", "target": "SURRENDER", "once": true },
    "text": [
      "> You comply. You're brought to the facility. Cell 7.",
      "> Concrete walls. No windows. Miller sits outside.",
      "> 'You should have followed orders, Agent.'",
      "> Hours pass. Or days. The lights never dim.",
      "> On the third cycle, you notice the vent. Loose panel.",
      "> [🔓] ESCAPE OPPORTUNITY DETECTED"
    ],
    "choices": [
      { "id": "ESCAPE", "prompt": "[🔧] PRY the vent panel", "requirements": null, "outcomes": ["CELL-02"] }
    ],
    "effects": {
      "delta": {},
      "set": { "is_caught": true },
      "unlock_beats": [],
      "grant_items": [],
      "teleport": null
    }
  },

  {
    "id": "CELL-02",
    "trigger": { "type": "manual", "target": "ESCAPE", "once": true },
    "text": [
      "> You vault the statue, sprint for the subway. Gunfire echoes.",
      "> Miller: 'He's going dark! All units, CONTAIN!'",
      "> Down the stairs. Into darkness. The hatch closes behind you.",
      "> [🏃] STATUS: ON THE RUN",
      "> [📍] LOCATION: UNDERGROUND",
      "> [⛓️] AGENCY TRUST: 0 (BECAME HOSTILE)",
      "> The mission has changed. You're no longer the hunter."
    ],
    "choices": null,
    "effects": {
      "delta": {},
      "set": { "agency_trust": 0, "escaped_cell": true, "is_caught": true },
      "unlock_beats": [],
      "grant_items": [],
      "teleport": "SUBWAY_STATION"
    }
  },

  {
    "id": "CODEC_HANDLER_INTRO",
    "trigger": { "type": "manual", "target": "CODEC-141.3", "once": false },
    "text": [
      "> [📻] CODEC 141.3 — HANDLER",
      "> 'Status, Agent? Chen's gone dark. Last ping: Hollow Creek.'",
      "> 'Your mission is simple. Locate. Extract. Neutralize if compromised.'",
      "> 'Don't ask questions about the client. Just get the asset.'",
      "> [💬] END TRANSMISSION"
    ],
    "choices": null,
    "effects": null
  },

  {
    "id": "CODEC-142.7",
    "trigger": { "type": "manual", "target": "CODEC-142.7", "once": true },
    "text": [
      "> [📻] CODEC 142.7 — UNKNOWN",
      "> 'You should not be here, Agent.'",
      "> Female voice. Russian accent.",
      "> 'The Pinkertons have paid the Russians well to keep their secrets.'",
      "> 'But I'm tired of cleaning up their mess. Listen carefully.'",
      "> 'The pandas are not animals. They never were.'",
      "> The line goes dead.",
      "> [📡] UNKNOWN FREQUENCY TRACKED: 142.7",
      "> [🎯] UNLOCKED: RUSSIAN CONTACT (Yekaterina Volkova)"
    ],
    "choices": null,
    "effects": {
      "delta": { "pinkerton_awareness": 25 },
      "set": { "russian_contact_established": true },
      "unlock_beats": ["DOCKS-03-CONFESSION"],
      "grant_items": [],
      "teleport": null
    }
  },

  {
    "id": "TAVERN-01",
    "trigger": { "type": "location_enter", "target": "TAVERN", "once": true },
    "text": [
      "> The Rusty Anchor. Smell of stale beer.",
      "> The bartender polishes glasses. Too attentive.",
      "> You notice a coin on the bar. Private eye insignia.",
      "> [🪙] PINKERTON COIN",
      "> Someone's been here. Recently. Watching.",
      "> A woman in the corner vanishes when you look."
    ],
    "choices": null,
    "effects": {
      "delta": { "pinkerton_awareness": 10 },
      "set": {},
      "unlock_beats": [],
      "grant_items": ["ITM-008"],
      "teleport": null
    }
  },

  {
    "id": "CHURCH-01",
    "trigger": { "type": "location_enter", "target": "CHURCH", "once": true },
    "text": [
      "> St. Sebastian. Empty save for an old man at the altar.",
      "> Father Mathias. Forty years here. He knows more than he says.",
      "> 'You're looking for something, son. I can tell.'",
      "> 'The asset?' you ask.",
      "> He chuckles. 'I don't know your business. But I know Chen Wei-Lin.'",
      "> 'He came here. Three days ago. Asked about the archive.'",
      "> 'I told him the same I'll tell you: The door only opens from inside.'",
      "> He gestures to the altar. 'Help me with the candles, and I might help.'"
    ],
    "choices": [
      { "id": "A", "prompt": "[🕯] HELP with candles (gain ITM-006)", "requirements": null, "outcomes": ["CHURCH-01-HELP"] },
      { "id": "B", "prompt": "[❓] PRESS for information", "requirements": null, "outcomes": ["CHURCH-01-PRESS"] },
      { "id": "C", "prompt": "[🔍] INVESTIGATE altar (gain ITM-007)", "requirements": null, "outcomes": ["CHURCH-01-ALTAR"] }
    ],
    "effects": null
  },

  {
    "id": "CHURCH-01-HELP",
    "trigger": { "type": "manual", "target": "CHURCH-HELP", "once": true },
    "text": [
      "> You help the old man with the candles.",
      "> His hands shake. 'Thank you, son.'",
      "> He presses something into your palm. A key. Rusty.",
      "> 'The archive... it's not what you expect.'",
      "> He turns back to the altar. Silent.",
      "> [🗝] RUSTY KEY acquired"
    ],
    "choices": null,
    "effects": {
      "delta": {},
      "set": {},
      "unlock_beats": [],
      "grant_items": ["ITM-006"],
      "teleport": null
    }
  },

  {
    "id": "CHURCH-01-PRESS",
    "trigger": { "type": "manual", "target": "CHURCH-PRESS", "once": true },
    "text": [
      "> 'Jesuits have been here since 1624,' he says quietly.",
      "> 'Longer than America. Longer than this town.'",
      "> 'We came to keep balance. Some truths are too dangerous.'",
      "> He pauses. 'Chen Wei-Lin... his father understood that.'",
      "> 'His father found things in the archive. Things that changed him.'",
      "> 'Now the son seeks the same answers.'",
      "> [📜] UNLOCKED: JESUIT PRESENCE 1624"
    ],
    "choices": null,
    "effects": {
      "delta": { "kaniksu_knowledge": 20 },
      "set": {},
      "unlock_beats": [],
      "grant_items": [],
      "teleport": null
    }
  },

  {
    "id": "CHURCH-01-ALTAR",
    "trigger": { "type": "manual", "target": "CHURCH-ALTAR", "once": true },
    "text": [
      "> You examine the altar closely.",
      "> Behind the crucifix, a false panel.",
      "> Inside: A book. Leather bound. Latin.",
      "> [📖] JESUIT BIBLE acquired",
      "> The pages speak of a protocol. 'Kaniksu.'",
      "> 'The children of the Middle Kingdom shall be kept divided.'",
      "> 'The panda gift shall ensure eternal instability.'"
    ],
    "choices": null,
    "effects": {
      "delta": { "kaniksu_knowledge": 15 },
      "set": { "panda_truth": true },
      "unlock_beats": [],
      "grant_items": ["ITM-007"],
      "teleport": null
    }
  },

  {
    "id": "CHURCH-02-KANIKSU",
    "trigger": { "type": "synergy_complete", "target": "SYN-N03", "once": true },
    "text": [
      "> The key turns. The lock clicks.",